{
  "schema_version": "1.0.0",
  "candidate_name": "resnet18_fp6_e3m2_guard",
  "selection_categories": ["guard", "family_alternative"],
  "selection_reason": "Illustrative schema witness for a public guard candidate; not a D11 selection.",
  "experiment_sha256": "7777777777777777777777777777777777777777777777777777777777777777",
  "model_graph": {
    "path": "artifacts/folded_graphs/resnet18_bn_folded_v1.bin",
    "sha256": "2222222222222222222222222222222222222222222222222222222222222222",
    "bytes": 1,
    "media_type": "application/octet-stream"
  },
  "encoded_weights": [
    {
      "path": "artifacts/quantized_weights/resnet18_fp6_e3m2.bin",
      "sha256": "8888888888888888888888888888888888888888888888888888888888888888",
      "bytes": 1,
      "media_type": "application/octet-stream"
    }
  ],
  "tensor_scales": [],
  "datatype_manifests": {
    "weight": {
      "name": "fp6_e3m2_finite",
      "path": "public/formats/manifests/fp6_e3m2_finite.json",
      "sha256": "5555555555555555555555555555555555555555555555555555555555555555"
    },
    "activation": {
      "name": "fp6_e3m2_finite",
      "path": "public/formats/manifests/fp6_e3m2_finite.json",
      "sha256": "5555555555555555555555555555555555555555555555555555555555555555"
    },
    "accumulator": {
      "name": "fp16_e5m10",
      "path": "public/formats/manifests/fp16_e5m10.json",
      "sha256": "6666666666666666666666666666666666666666666666666666666666666666"
    },
    "output": {
      "name": "fp6_e3m2_finite",
      "path": "public/formats/manifests/fp6_e3m2_finite.json",
      "sha256": "5555555555555555555555555555555555555555555555555555555555555555"
    }
  },
  "operator_metadata": {
    "semantics_version": "1.0.0",
    "policy": "strict",
    "batchnorm_folded": true,
    "bias_domain": "accumulator"
  },
  "arithmetic": {
    "mac_model": "full_product",
    "product_precision": "exact_to_accumulator",
    "reduction_order": "sequential",
    "requantization_point": "operator_output_store"
  },
  "public_quality": [
    {
      "workload": "resnet18_imagenet_1k",
      "evaluation_manifest_sha256": "4444444444444444444444444444444444444444444444444444444444444444",
      "fp32_metrics": {
        "top1_percent": 69.75,
        "top5_percent": 89.07
      },
      "quantized_metrics": {
        "top1_percent": 68.95,
        "top5_percent": 88.61
      },
      "delta_metrics": {
        "top1_percentage_points": -0.8,
        "top5_percentage_points": -0.46
      },
      "confidence_intervals": {
        "top1_percentage_points": {
          "level": 0.95,
          "lower": -1.5,
          "upper": -0.2,
          "method": "paired_bootstrap"
        }
      }
    }
  ],
  "generic_hardware": {
    "configuration_sha256": "9999999999999999999999999999999999999999999999999999999999999999",
    "pdk": "ics55",
    "library": "rvt",
    "corner": "illustrative",
    "vt": "rvt",
    "metrics": {
      "area_mm2": 0.01,
      "fmax_mhz": 100.0,
      "energy_per_operation_pj": 1.0
    },
    "quality_attached": true,
    "evidence_level": "generic_system",
    "limitations": ["Illustrative Phase 0 schema witness; values are not measured results."]
  },
  "provenance": {
    "checkpoint_sha256": "1111111111111111111111111111111111111111111111111111111111111111",
    "graph_sha256": "2222222222222222222222222222222222222222222222222222222222222222",
    "calibration_manifest_sha256": "3333333333333333333333333333333333333333333333333333333333333333",
    "evaluation_manifest_sha256": "4444444444444444444444444444444444444444444444444444444444444444",
    "software_commit": "illustrative",
    "repository_state": "clean"
  }
}
